STATE FISH,FEMALE TITLE ROLES,ROARING '20s READER,U.S. UNIVERSITY TOWNS,"""EYE"" WITNESS",TEXAS CHILDREN'S HOSPITAL
"A sculpture of this fish, a symbol of Massachusetts for more than 200 years, hangs in the state house in Boston","""Private Benjamin""(1980)","In Warwick Deeping's 1925 ""Sorrell & Son"", a vet of this war makes sacrifices to raise his son",Florida State University,Make this direct visual link with an interviewer,"(Dr. Arnold delivers the clue.)  Able to replicate an operating room, emergency room & more, Texas Children's Hospital's Simulation Center provides an ideal environment for risk-free training in obstetrics & this branch of medicine that deals with the care of children"
"Known as the ""striper"", it's South Carolina's state fish","""Frida""(2002)","""Incident at West Egg"" was a title considered for this classic",DePaul University,"At the sad moment ""there wasn't"" this ""in the house""",(Dr. Arnold delivers the clue.)  Studies have shown that simulation-based training improves success rates in procedures such as this insertion of a tube into the trachea to ensure an open airway
"Maine's state fish, the landlocked this, migrates to various lakes & rivers to spawn, laying eggs in nests called redds","""Gilda""(1946)","Double Jeopardy: ""Connie, this is the new game-keeper"" is a line from this scandalous 1928 novel",Temple University,A translucent visor used as a shield against strong light,"(Dr. Arnold delivers the clue.)  In a simulation involving a patient in cardiac arrest, the attending physician must recognize the need to begin this application of electricity to shock an arrhythmic heart back into a normal beat"
"This denizen of the deep, Florida's state saltwater fish, could give some boats a run for their money","""The Young Victoria""(2009)","John Erskine hit the bestseller list with ""The Private Life of"" this beauty of the classical world",American University,"When this happens in a song lyric, ""that's amore!""","(Dr. Arnold delivers the clue.)  Key to the simulation process are computer-controlled mannequins that can breathe, bleed, & display symptoms such as this enlargement of the pupil that can indicate head trauma"
In 1987 Tennessee chose the channel species of this as a state fish; Nebraska followed in 1997,"""Marnie""(1964)",Unitarian minister Leon Birkhead served as an advisor to Sinclair Lewis while Lewis was writing this 1927 novel,Liberty University,The horse that wins the Preakness Stakes is draped in a blanket of these flowers,"Double Jeopardy: (Dr. Arnold delivers the clue.)  Simulations are so realistic that  in one scenario apparent respiratory distress helps team members learn to distinguish between an asthma attack & this allergen-induced condition in which blood pressure & oxygen levels drop, requiring emergency response"
