"SOUNDS CRIMINAL, BUT ISN'T",MOVIES IN THE SKY,COLLEGES OF OXFORD,EMPIRES,"ACA""D""MIA",LITERARY MASHUPS
battery,Skyfall,the G,Ottoman,deduction,A Doll's House/i and iHedda Gabler
Jaywalking,John Malkovich,John le Carré,Prussia,dissect,Mansfield Park/i and iNorthanger Abbey
accessory,(Jake) Gyllenhaal,manners,Napoleon,distance learning,The Pelican Brief/i and iRunaway Jury
a racket,Eye in the Sky,Charles I,Powhatan,dissertations,The Old Man and the Sea/i and iIslands in the Stream
a murder,Kurt Russell,Philip Pullman,Byzantine,drill and kill,Portnoy's Complaint/i and iAmerican Pastoral
