MOUNTAINS,SCREEN STARS,THE HUMAN BODY,STATISTICS,FOX HUNTING,"""GOLD"""
Japan's national symbol,"Actor who co-directed the film ""The Green Berets""",Acid here sterilizes digested food & kills bacteria,Almost 25% of all U.S. seminarians of this religion are of Irish descent,Shout that signals the beginning of the hunt,"A miner, or a Broadway baby who marries for money"
"Tho the mts. between Pakistan & Afghanistan are not well-known, this famous pass thru them is","4-time Oscar nominee & star of TV's ""Big Valley"", said to have once been highest-paid woman in U.S.",The femur is the longest one in the body,"Of courtesy, food or on-time performance, the 1 air travelers in recent USA Today survey rated most important","Traditionally, the master of the hunt wears a velvet cap of this color","Normally, sheets of this are only 3 to 5 millionths of an inch thick"
Those who have gone in search of Noah's Ark have centered on this mountain in Turkey,"She was named Queen of Hollywood in 1936, after playing Nora Charles","About 45% of this is made of erythrocytes, leukocytes, & platelets","With over 1/4 mil. employees in 1985, this discount chain was #7 employer in U.S.","In fox hunting, this is referred to as the fox's ""brush""",A kind of carp
"It's said the Indian name for this mountain area near Seattle means ""mountain that was God""","Double Jeopardy: He said, ""I was a 14-year-old boy for 30 years""",The 1st metacarpal is located in this digit of the hand,"Within a year of buying a house, 38% of home owners purchase one of these for the garage",This clue was missing,A worker who's a shirker
"Of all 7 continents' highest peaks, 7310' Mt. Kosciusko, on this continent, is the lowest","He co-starred w/Jeanette MacDonald in ""I Married an Angel"" but married Ann Franklin","Roughly triangular, this muscle gives the rounded contour to the shoulder","With over 1000 people per square mile, this Mid-Atlantic state is most densely populated",This clue was missing,"In the famous short story, it's dropped through the eye of a skull to unearth a fortune"
