CURRENT EVENTS,MEDICINE,SONG LYRICS,TRANSPORTATION,SPIDERS & SNAKES,ALICE THROUGH THE LOOKING GLASS
Mississippi River,go to sleep,Broadway,trains,rattlesnakes,chess
Iran amp Iraq,VDTs (video data terminals),your arms,Carnival,having no snakes,Jabberwocky
Sweden,leg,the field artillery,Rolls Royce,This answer was missing,Tweedledum amp Tweedledee
Zia,vitamin A,kisses,Germany,This answer was missing,This answer was missing
plant closures,Lyme fever (Lyme disease),silence,Atlanta,brown recluse,cat
