GET YOUR KICKS,THE NIFTY '50s,STATE FLAG SUBJECTS,DOUBLE LETTER X2,IT'S THE WORLD ECONOMY,"""STUPID"""
ballet,Sputnik,This answer was missing,coffee,This answer was missing,This answer was missing
a free kick,(Roger) Bannister,the Big Dipper and the North Star,bassoon,tourism,Stupid is as stupid does
Kickstarter,the AFL and CIO,the Confederate flag,penniless,bananas,"Keep it simple, stupid"
finishing,the iNautilus/i,Oregon,a woodcutter,unemployment,"iCrazy, Stupid, Love/i"
champagne,Adlai Stevenson,bears,buttress,Germany,"Fat, drunk, and stupid"
